EVENT_ID,CZ_NAME_STR,BEGIN_LOCATION,BEGIN_DATE,BEGIN_TIME,EVENT_TYPE,MAGNITUDE,TOR_F_SCALE,DEATHS_DIRECT,INJURIES_DIRECT,DAMAGE_PROPERTY_NUM,DAMAGE_CROPS_NUM,STATE_ABBR,CZ_TIMEZONE,MAGNITUDE_TYPE,EPISODE_ID,CZ_TYPE,CZ_FIPS,WFO,INJURIES_INDIRECT,DEATHS_INDIRECT,SOURCE,FLOOD_CAUSE,TOR_LENGTH,TOR_WIDTH,BEGIN_RANGE,BEGIN_AZIMUTH,END_RANGE,END_AZIMUTH,END_LOCATION,BEGIN_LAT,BEGIN_LON,END_LAT,END_LON,EVENT_NARRATIVE,EPISODE_NARRATIVE,ABSOLUTE_ROWNUMBER
5130290,ALLEGHENY (ZONE), ,01/10/2000,1345,High Wind,50, ,0,0,1000,0,PA,EST,E,1090593,Z,21,PBZ,0,0,TRAINED SPOTTER, , , , , , , , , , , , ,"A large tree was downed by strong winds in Moon Township.","A strong cold front associated with a deepening area of low pressure blew through western Pennsylvania during the afternoon of the 10th.  Behind this front, strong winds gusting in excess of 50 knots were found across many counties in western Pennsylvania, resulting in numerous downed trees and power lines.",1
5130399,ALLEGHENY (ZONE), ,01/10/2000,1348,High Wind,50, ,0,0,0,0,PA,EST,M,1090593,Z,21,PBZ,0,0,AWOS,ASOS,MESONET,ETC, , , , , , , , , , , , ,"A wind gust to 58 MPH (50 knots) was recorded at the Allegheny County Airport.","A strong cold front associated with a deepening area of low pressure blew through western Pennsylvania during the afternoon of the 10th.  Behind this front, strong winds gusting in excess of 50 knots were found across many counties in western Pennsylvania, resulting in numerous downed trees and power lines.",2
5130400,ALLEGHENY (ZONE), ,01/10/2000,1355,High Wind,50, ,0,0,2000,0,PA,EST,E,1090593,Z,21,PBZ,0,0,TRAINED SPOTTER, , , , , , , , , , , , ,"Two large trees were downed by strong winds in the Springdale area.","A strong cold front associated with a deepening area of low pressure blew through western Pennsylvania during the afternoon of the 10th.  Behind this front, strong winds gusting in excess of 50 knots were found across many counties in western Pennsylvania, resulting in numerous downed trees and power lines.",3
5133117,ALLEGHENY (ZONE), ,02/19/2000,400,Flood, , ,0,0,1000000,0,PA,EST, ,1091431,Z,21,PBZ,0,0,NEWSPAPER, , , , , , , , , , , , ,"","Widespread heavy rains of between 2.0 and 3.0 inches fell across southwest Pennsylvania on February 18th. This rain fell onto ground that was already nearly saturated from heavy rainfall a few days earlier.  These conditions produced moderate flash flooding across the southwest corner of the state starting late on the 18th and continued into the 19th.  

However, the heaviest rainfall during this event occurred over the headwaters of the Monongahela River in northern West Virginia, where widespread rainfall exceeding 3.0 inches was recorded.  This produced major river flooding downstream along the Monongahela River towards Pittsburgh.  This rain event also produced minor flooding along the Youghiogheny River. 

The following are crests/flood stages in feet for several locations along the Monongahela River:  Point Marion  32.3 feet (crest)/26 feet (flood stage); Grays Landing 24.5/22; Maxwell 36.5/32; Charleroi 38.5/28; Elizabeth 27.6/20 and Braddock 24.2/22.  Along the Youghiogheny River, only one forecast point went over flood stage as  Connellsville crested at 12.5 feet, just above the flood stage of 12 feet.  

In response to the river flooding, the Governor of Pennsylvania declared a disaster emergency for four counties (Allegheny, Fayette, Washington and Westmoreland) in southwest Pennsylvania.  In those four counties, the Pennsylvania Emergency Management Agency estimated just over 600 homes were damaged by the flooding.  However, most of those homes sustained basement damage only.  The hardest-hit county was Washington, where around 400 homes sustained damage.  The city of Monongahela, also in Washington County, appeared to be the hardest-hit community, as 23 homes reported major damage and another 77 received minor damage.  In Allegheny County, the most serious damage appeared to be concentrated in Elizabeth and West Elizabeth where 31 homes had minor damage and one suffered major damage.  In Greene County, although most of the damage was limited to several flooded roads and basements, the Greene Cove Yacht Club reported damage of around $500,000.  Despite the damage sustained across the four counties, no injuries were reported.        

In Pittsburgh, the Ohio River at the Point crested at 23.7 feet, just below the flood stage of 25 feet.  This forced the closure of the Mon Parking Wharf, Point State Park, and the 10th Street Bypass.",4
5138624,ALLEGHENY CO.,VERONA,04/20/2000,2245,Thunderstorm Wind, , ,0,0,1000,0,PA,EST, ,1093080,C,3,PBZ,0,0,FIRE DEPT/RESCUE SQUAD, , , , , , , ,VERONA,40.52,-79.83,40.52,-79.83,"Thunderstorm winds downed several large tree limbs.","",5
5142678,ALLEGHENY CO.,MOON,05/19/2000,340,Thunderstorm Wind, , ,0,0,2000,0,PA,EST, ,1094640,C,3,PBZ,0,0,LAW ENFORCEMENT, , , , , , , ,MOON,40.50,-80.23,40.50,-80.23,"Thunderstorm winds downed a few trees along Beaver Grade Road.","",6
5152020,ALLEGHENY CO.,MONROEVILLE,06/11/2000,1935,Thunderstorm Wind, , ,0,0,1000,0,PA,EST, ,1098156,C,3,PBZ,0,0,LAW ENFORCEMENT, , , , , , , ,MONROEVILLE,40.43,-79.82,40.43,-79.82,"Thunderstorm winds downed a large tree.","",7
5152021,ALLEGHENY CO.,WILKINS TOWNSHIP,06/11/2000,1944,Thunderstorm Wind, , ,0,0,1000,0,PA,EST, ,1098156,C,3,PBZ,0,0,LAW ENFORCEMENT, , , , , , , ,WILKINS TOWNSHIP,40.45,-79.82,40.45,-79.82,"Thunderstorm winds downed a large tree.","",8
5152028,ALLEGHENY CO.,EMSWORTH,06/14/2000,2229,Thunderstorm Wind, , ,0,0,1000,0,PA,EST, ,1098157,C,3,PBZ,0,0,LAW ENFORCEMENT, , , , , , , ,EMSWORTH,40.52,-80.08,40.52,-80.08,"Thunderstorm winds downed a large tree.","",9
5152029,ALLEGHENY CO.,CORAOPOLIS,06/14/2000,2240,Thunderstorm Wind, , ,0,0,2000,0,PA,EST, ,1098157,C,3,PBZ,0,0,LAW ENFORCEMENT, , , , , , , ,CORAOPOLIS,40.52,-80.17,40.52,-80.17,"Thunderstorm winds downed a few trees onto Snyder Road.","",10
5152030,ALLEGHENY CO.,SEWICKLEY,06/14/2000,2256,Thunderstorm Wind, , ,0,0,10000,0,PA,EST, ,1098157,C,3,PBZ,0,0,LAW ENFORCEMENT, , , , , , , ,SEWICKLEY,40.55,-80.18,40.55,-80.18,"Thunderstorm winds downed a large tree onto a car, trapping a person inside.","",11
5154670,ALLEGHENY CO.,BRADFORD WOODS,06/29/2000,1845,Thunderstorm Wind, , ,0,0,5000,0,PA,EST, ,1098160,C,3,PBZ,0,0,LAW ENFORCEMENT, , , , , , , ,BRADFORD WOODS,40.63,-80.08,40.63,-80.08,"Thunderstorm winds downed several large trees.","",12
5162637,ALLEGHENY CO.,IMPERIAL,07/28/2000,1410,Flash Flood, , ,0,0,5000,0,PA,EST, ,1099768,C,3,PBZ,0,0,LAW ENFORCEMENT, , , , , , , ,IMPERIAL, , , , ,"Minor street flooding was reported in Imperial.  Just west of this area, up to 6 inches of water was reported on the roadway at the intersection of US Route 22 and SR 60.  Also in this area, Campbells Run Creek rose out of its banks, partially flooding Campbells Run Road.","Heavy thunderstorms passing over western Pennsylvania produced rainfall of up to 2 inches in an hour over several counties, producing numerous instances of flash flooding.",13
5162642,ALLEGHENY CO.,EMSWORTH,07/28/2000,1715,Flash Flood, , ,0,0,0,0,PA,EST, ,1099769,C,3,PBZ,0,0,NEWSPAPER, , , , , , , ,EMSWORTH, , , , ,"Street flooding was reported in the Emsworth area, where Lowries Run overflowed its banks and flooded portions of Camp Horn Road near Interstate 79 and SR 65.","Another round of strong thunderstorms passed over western Allegheny and northwestern Washington Counties.  These areas had received up to two inches of rain from thunderstorms just a few hours earlier.",14
5162727,ALLEGHENY CO.,WILKINSBURG,07/30/2000,1900,Flash Flood, , ,0,0,10000,0,PA,EST, ,1099770,C,3,PBZ,0,0,LAW ENFORCEMENT, , , , , , , ,WILKINSBURG, , , , ,"Strong thunderstorm producing up to one and one half inches of rain in one hour produced street flooding in the Wilkinsburg and Swissvale areas.","",15
5163047,ALLEGHENY CO.,BRIDGEVILLE,07/31/2000,2000,Flash Flood, , ,0,0,20000,0,PA,EST, ,1099772,C,3,PBZ,0,0,LAW ENFORCEMENT, , , , , , , ,BRIDGEVILLE, , , , ,"Numerous reports of street flooding were received from the Bridgeville area, as well as from Collier Township, South Fayette Township and Carnegie.","Strong thunderstorms passed over areas of western Pennsylvania that had already received several inches of rain over the past few days.  These thunderstorms produced torrential rainfall of up to 3 inches in 90 minutes as they moved across the area, creating flash flooding problems across several counties.",16
5174756,ALLEGHENY CO.,DORMONT,08/06/2000,735,Flash Flood, , ,0,0,0,0,PA,EST, ,1103034,C,3,PBZ,0,0,LAW ENFORCEMENT, , , ,2,SE,2,SE,DORMONT, , , , ,"Roadway flooding was reported on Saw Mill Run Boulevard in the South Hills.","Thunderstorms training across southwest Pennsylvania produced rainfall amounts of between 1.5 and 2.0 inches in less than 2 hours, creating widespread flash flooding problems.",17
5174809,ALLEGHENY CO.,COUNTYWIDE,08/06/2000,1240,Flash Flood, , ,0,0,10000,0,PA,EST, ,1103036,C,3,PBZ,0,0,LAW ENFORCEMENT, , , , , , , ,COUNTYWIDE, , , , ,"Street and roadway flooding was reported in and around the Clairton and Elizabeth areas.  In McKeesport, some basement flooding was reported.","Another wave of thunderstorms passed over portions of southwest Pennsylvania where over 2 inches of rain had already fallen earlier in the day.  As a result, flash flooding continued across the area.",18
5175137,ALLEGHENY CO.,COUNTYWIDE,08/06/2000,2135,Flash Flood, , ,0,0,10000000,0,PA,EST, ,1103038,C,3,PBZ,0,0,NEWSPAPER, , , , , , , ,COUNTYWIDE, , , , ,"Widespread flash flooding problems were reported across the county, with 51 of the county's 130 municipalities reporting some degree of storm impact.  Of those 51 municipalities, 15 reported significant impact, including flooding of streets and basements, washed-away property and cars, and roadway infrastructure damage.  An estimated 1200 homes and businesses in those 51 communities were impacted.  The Allegheny County Chief Executive's office reported the hardest-hit communities were Baldwin, Brentwood, Hays, Mt. Lebanon, West Mifflin, and the City of Pittsburgh along the Route 51/88 corridor.  

The town of Hays was probably the hardest hit of all the communities, with over 75 homes and 20 commercial properties reporting heavy damage.  Several cars were swept away by the floodwaters, forcing the rescue of several people who were trapped in the vehicles.  The water even swept away a pleasure boat parked in a private driveway.  Emergency officials also rescued several people trapped in their homes by the high water.  

In McKeesport, a car dealership along State Route 48 saw a 3- to 4-foot high wall of water and mud ruin 35 to 40 new cars -- an estimated $2 million dollar loss.  Several businesses in downtown McKeesport, along with City Hall, received minor water damage.  At The Marina at McKees Point, 16 boats were lost and a pier buckled.  

Elsewhere across the county, numerous reports of flooded basements, stream flooding and mudslides were received throughout the evening of the 6th and early morning hours of the 7th.","During the morning and afternoon hours of the 6th, strong thunderstorms produced between 2 and 4 inches of rain across Allegheny, Washington and Westmoreland Counties.  Throughout the evening of the 6th and the early morning hours of the 7th, more thunderstorms formed and trained along a west-to-east line over these counties.  These thunderstorms produced another 2 to 3 inches of rain across this area.  Final rainfall totals for this event in Allegheny County include 5.71 inches at the Allegheny County Airport in West Mifflin (4.27 inches through midnight, plus another 1.41 inches during the early morning hours of the 7th), 5.55 inches in Baldwin Borough, 5.25 inches in Castle Shannon and 4.3 inches in Pleasant Hills.  The Pittsburgh International Airport set a record for the 6th, recording 1.59 inches of rain.  

In Washington County, 3.4 inches of rain were recorded in Burgettstown from this event, and 3.2 inches in the city of Washington.  In Westmoreland County, 3.3 inches fell in Jeanette, with 3.2 inches recorded in both Derry and Murrysville.  Several other locations across these counties recorded rainfall ranging between 2 and 3 inches.",19
5157290,ALLEGHENY CO.,CASTLE SHANNON,08/06/2000,2153,Thunderstorm Wind, , ,0,0,5000,0,PA,EST, ,1103040,C,3,PBZ,0,0,LAW ENFORCEMENT, , , , , , , ,CASTLE SHANNON,40.35,-80.05,40.35,-80.05,"Thunderstorm winds downed several trees and power lines.","",20
5156355,ALLEGHENY CO.,MONROEVILLE,09/02/2000,1920,Flash Flood, , ,0,0,0,0,PA,EST, ,1103190,C,3,PBZ,0,0,LAW ENFORCEMENT, , , , , , , ,MONROEVILLE, , , , ,"Heavy thunderstorm rains produced minor flooding on several roadways in the Monroeville area.","",21
5166754,ALLEGHENY (ZONE), ,12/12/2000,357,High Wind,50, ,0,0,100000,0,PA,EST,M,1105335,Z,21,PBZ,0,0,AWOS,ASOS,MESONET,ETC, , , , , , , , , , , , ,"","A strengthening area of low pressure and associated cold front swept across the area during the overnight hours, bringing high winds to much of western Pennsylvania.  In general, damage was confined mostly to numerous downed trees and power lines, resulting in a loss of power to an estimated 150,000 homes across western Pennsylvania.  However, several incidents of property damage were also reported.  

In Sharon, Mercer County, wind gusts estimated as high as 70 MPH blew a tree down onto a garage, causing considerable damage.  Several homes in Sharon also had parts of their siding blown away.  

The highest wind in the event was an estimated 75 MPH gust in Farmington, Fayette County.  Part of a roof was blown from a barn at that location.  

In Indiana County, the high wind damaged several residential roofs and produced isolated incidents of structural damage.  
 
Several residences and businesses in Beaver County reported property damage.  A window was blown in at a fast-food restaurant in Conway.  A pavilion at a park in Monaca was blown over.  In Industry, a tree was blown onto a van, crushing it.  In South Beaver, the roof was partially ripped off of an industrial supply company.  A partially constructed house in the Beaver area was also blown down by the wind.    

In Armstrong County, a roof blew off of a building along Main Street in Elderton.  In North Buffalo, the winds ripped off three-quarters of the roof of a monastery.  

In Allegheny County, these strong winds resulted in the loss of electricity to an estimated 100,000 homes across the county.  In the city of Pittsburgh, two abandoned buildings had their walls blown in.  Several reports were also received from across the city of porch awnings and sheds blown down by the wind.",22
5166767,ALLEGHENY (ZONE), ,12/13/2000,2100,Winter Storm, , ,0,0,0,0,PA,EST, ,1105336,Z,21,PBZ,0,0,LAW ENFORCEMENT, , , , , , , , , , , , ,"","A mix of sleet, freezing rain and snow spread across western Pennsylvania during the day on the 13th.  By late afternoon on the 13th, the snow turned over to sleet in many areas, with several counties reporting sleet accumulations of up to one inch.  Finally, by the evening hours of the 13th the precipitation had turned over to freezing rain across all of western Pennsylvania.  Every county across the area reported ice accumulations of one-quarter to one-half inch by the late evening hours on the 13th.  Numerous accidents were reported on area highways as the freezing rain coated roadways.  Various stretches of heavily-traveled Route 30 were closed in Allegheny and Westmoreland Counties during the evening due to the accidents.  Overnight, the freezing precipitation gradually turned over to rain.  However, even by the early morning hours of the 14th a few pockets of freezing drizzle were still being reported as cold air remained trapped in some of the valleys.",23
5229598,ALLEGHENY (ZONE), ,01/20/2001,2100,Heavy Snow, , ,0,0,0,0,PA,EST, ,1110379,Z,21,PBZ,0,0,LAW ENFORCEMENT, , , , , , , , , , , , ,"","An upper-level disturbance passing over east-central Kentucky deepened rapidly during the late afternoon hours of the 20th, producing a several-hour period of heavy snow over southwestern Pennsylvania.  County snowfall totals across the area were as follows:
Allegheny, 4-6 inches; Fayette, 7-8 inches; Greene, 5-8 inches; Indiana 7-9 inches; Washington, 4-7 inches; Westmoreland 7-11 inches.",24
5229604,ALLEGHENY CO.,MC KEESPORT,01/31/2001,2055,Flash Flood, , ,0,0,2000000,0,PA,EST, ,1110380,C,3,PBZ,0,0,LAW ENFORCEMENT, , , , , , , ,MC KEESPORT, , , , ,"Ice jams moving down the Youghiogheny River produced minor flooding from Boston down to the McKeesport area.  The movement of the ice itself caused the main problem, as it tore apart and destroyed 210 boat docks at the McKeesport Marina on its way out into the Monongahela River","",25
5230949,ALLEGHENY (ZONE), ,02/25/2001,1050,High Wind, , ,0,0,5000,0,PA,EST, ,1110589,Z,21,PBZ,0,0,LAW ENFORCEMENT, , , , , , , , , , , , ,"","An intense area of low pressure passing over the region brought a prolonged period of high winds to western Pennsylvania.  Although the highest recorded wind was only 60 MPH (at the Beaver Falls Airport, Beaver County), wind gusts to over 50 MPH continued from late morning into the early evening hours, downing numerous trees, large limbs and power lines across the entire area.",26
5240083,ALLEGHENY CO.,MUNHALL,04/09/2001,1630,Thunderstorm Wind, , ,0,0,1000,0,PA,EST, ,1113005,C,3,PBZ,0,0,TRAINED SPOTTER, , , , , , , ,MUNHALL,40.40,-79.92,40.40,-79.92,"Thunderstorm winds downed a large tree.","A strong cold front passing across the area produced the first severe weather outbreak of the spring season.  Numerous hail reports were received from across western Pennsylvania, with the hailstones ranging in diameter from dime-sized to as large as golfballs.",27
5241166,ALLEGHENY CO.,PITTSBURGH,05/18/2001,1725,Flash Flood, , ,0,0,25000,0,PA,EST, ,1113592,C,3,PBZ,0,0,LAW ENFORCEMENT, , , , , , , ,PITTSBURGH, , , , ,"Thunderstorms producing between 1 and 2 inches of rainfall were responsible for several flooded roadways and intersections in the Pittsburgh area.  Water backed up onto Route 65 in Bellevue, creating significant traffic delays.  Several reports of basement flooding were also received from the West Deer area.","",28
5251525,ALLEGHENY CO.,PITTSBURGH,06/21/2001,1945,Thunderstorm Wind, , ,0,0,5000,0,PA,EST, ,1116263,C,3,PBZ,0,0,LAW ENFORCEMENT, , , , , , , ,PITTSBURGH,40.43,-79.98,40.43,-79.98,"Thunderstorm winds downed several trees in the Pittsburgh area.","",29
5262365,ALLEGHENY CO.,MOON,07/01/2001,1257,Thunderstorm Wind,52, ,0,0,0,0,PA,EST,M,1120672,C,3,PBZ,0,0,AWOS,ASOS,MESONET,ETC, , , , , , , ,MOON,40.50,-80.23,40.50,-80.23,"A thunderstorm wind gust to 60 MPH was recorded at the Pittsburgh International Airport.","",30
5262366,ALLEGHENY CO.,MOON,07/01/2001,1315,Thunderstorm Wind, , ,0,0,5000,0,PA,EST, ,1120672,C,3,PBZ,0,0,TRAINED SPOTTER, , , , , , , ,MOON,40.50,-80.23,40.50,-80.23,"Thunderstorm winds downed several trees.","",31
5262372,ALLEGHENY CO.,WEXFORD,07/01/2001,1400,Thunderstorm Wind, , ,0,0,2000,0,PA,EST, ,1120672,C,3,PBZ,0,0,TRAINED SPOTTER, , , , , , , ,WEXFORD,40.63,-80.05,40.63,-80.05,"Thunderstorm winds downed a few trees.","",32
5262373,ALLEGHENY CO.,WEXFORD,07/01/2001,1400,Flash Flood, , ,0,0,1000,0,PA,EST, ,1120672,C,3,PBZ,0,0,TRAINED SPOTTER, , , ,2,S,2,S,WEXFORD, , , , ,"Strong thunderstorms produced over 2 inches of rain in less than an hour, which forced Fish Run and Wexford Run out of their banks in McCandless Township.","",33
5262379,ALLEGHENY CO.,CLAIRTON,07/05/2001,1330,Thunderstorm Wind, , ,0,0,25000,0,PA,EST, ,1120673,C,3,PBZ,0,0,BROADCAST MEDIA, , , , , , , ,CLAIRTON,40.30,-79.90,40.30,-79.90,"Thunderstorm winds blew the roof from a building, peeled some aluminum siding from another, and downed several trees along SR 837.","",34
5262475,ALLEGHENY CO.,LIBERTY,07/10/2001,1345,Thunderstorm Wind, , ,0,0,50000,0,PA,EST, ,1120675,C,3,PBZ,0,0,NEWSPAPER, , , , , , , ,LIBERTY,40.33,-79.88,40.33,-79.88,"Thunderstorm winds downed numerous trees in the Liberty and Glassport areas.  Several homes and one parked boat were damaged in Liberty from falling trees. On Elizabeth Street in Liberty, a children's playground and pavilion were damaged.  In nearby McKeesport, the thunderstorm winds also did some minor damage to a few radio towers.  Several trees were also reported down in the Munhall area.","",35
5262487,ALLEGHENY CO.,CARNEGIE,07/25/2001,1650,Thunderstorm Wind, , ,0,0,10000,0,PA,EST, ,1120677,C,3,PBZ,0,0,LAW ENFORCEMENT, , , , , , , ,CARNEGIE,40.42,-80.08,40.42,-80.08,"Thunderstorm winds downed numerous trees and power lines across the Carnegie and Greentree areas.","",36
5265469,ALLEGHENY CO.,MONROEVILLE,08/19/2001,1254,Thunderstorm Wind, , ,0,0,15000,0,PA,EST, ,1121944,C,3,PBZ,0,0,LAW ENFORCEMENT, , , , , , , ,MONROEVILLE,40.43,-79.82,40.43,-79.82,"Thunderstorm winds downed several large trees across area roadways.  One tree fell onto a house, causing minor damage.","",37
5265547,ALLEGHENY CO.,PITTSBURGH INTL ARPT,08/28/2001,1308,Thunderstorm Wind,52, ,0,0,0,0,PA,EST,M,1121946,C,3,PBZ,0,0,AWOS,ASOS,MESONET,ETC, , , , , , , ,PITTSBURGH INTL ARPT,40.48,-80.23,40.48,-80.23,"A wind gust to 60 MPH was recorded at the Pittsburgh International Airport.","",38
5265548,ALLEGHENY CO.,WEXFORD,08/28/2001,1320,Thunderstorm Wind, , ,0,0,5000,0,PA,EST, ,1121946,C,3,PBZ,0,0,TRAINED SPOTTER, , , , , , , ,WEXFORD,40.63,-80.05,40.63,-80.05,"Thunderstorm winds downed several trees.","",39
5265551,ALLEGHENY CO.,CLAIRTON,08/28/2001,1500,Thunderstorm Wind, , ,0,0,5000,0,PA,EST, ,1121946,C,3,PBZ,0,0,LAW ENFORCEMENT, , , , , , , ,CLAIRTON,40.30,-79.90,40.30,-79.90,"Thunderstorm winds downed several trees.","",40
5273712,ALLEGHENY (ZONE), ,12/14/2001,1920,High Wind,50, ,0,0,5000,0,PA,EST,E,1125030,Z,21,PBZ,0,0,LAW ENFORCEMENT, , , , , , , , , , , , ,"","High winds associated with a deep area of low pressure passing over the region downed numerous trees and power lines across western Pennsylvania.",41
5286788,ALLEGHENY CO.,COUNTYWIDE,03/09/2002,1900,Thunderstorm Wind, , ,0,0,50000,0,PA,EST, ,1132120,C,3,PBZ,0,0,LAW ENFORCEMENT, , , , , , , ,COUNTYWIDE,40.43,-80.05,40.43,-80.05,"Strong thunderstorm winds blew the roof off of a Pitcarin business.","A deepening area of low pressure moving eastward across the northern Great Lakes swept a strong cold front across western Pennsylvania during the late afternoon/early evening hours of the 9th.  This intensifying low produced a large area of strong low-level winds, both ahead of and behind the cold front, with winds between 70 - 80 MPH present just a few thousand feet off the surface by the mid-afternoon hours.  As showers formed during the day, these strong winds were occasionally brought down to the surface.  To further complicate matters, by the late afternoon hours enough instability was present to produce a line of severe thunderstorms along the main cold front as it entered western Pennsylvania.  This combination of strong gradient winds and severe thunderstorm winds produced widespread damage across the area, mostly in the form of downed trees and power lines.   These high winds continued after the cold frontal passage, downing trees and power lines, until the early morning hours of the 10th.  At that time, the surface low moved off into Quebec and the strong gradient winds finally diminished.  It is estimated that around 25,000 people were left without electricity in western Pennsylvania in the wake of this wind event.",42
5286789,ALLEGHENY (ZONE), ,03/09/2002,1915,High Wind, , ,0,0,10000,0,PA,EST, ,1132120,Z,21,PBZ,0,0,LAW ENFORCEMENT, , , , , , , , , , , , ,"","A deepening area of low pressure moving eastward across the northern Great Lakes swept a strong cold front across western Pennsylvania during the late afternoon/early evening hours of the 9th.  This intensifying low produced a large area of strong low-level winds, both ahead of and behind the cold front, with winds between 70 - 80 MPH present just a few thousand feet off the surface by the mid-afternoon hours.  As showers formed during the day, these strong winds were occasionally brought down to the surface.  To further complicate matters, by the late afternoon hours enough instability was present to produce a line of severe thunderstorms along the main cold front as it entered western Pennsylvania.  This combination of strong gradient winds and severe thunderstorm winds produced widespread damage across the area, mostly in the form of downed trees and power lines.   These high winds continued after the cold frontal passage, downing trees and power lines, until the early morning hours of the 10th.  At that time, the surface low moved off into Quebec and the strong gradient winds finally diminished.  It is estimated that around 25,000 people were left without electricity in western Pennsylvania in the wake of this wind event.",43
5286904,ALLEGHENY CO.,ELIZABETH,03/21/2002,600,Flash Flood, , ,0,0,5000,0,PA,EST, ,1132121,C,3,PBZ,0,0,OFFICIAL NWS OBS., , , , , , , ,ELIZABETH, , , , ,"","Heavy rains of 1.00 to 2.50 inches across the Monongahela River basin resulted in minor flooding on the Monongahela River in southwest Pennsylvania.  The Monongahela River crested at Charleroi at 28.1 feet (flood stage 28.0 feet) at 7 AM on March 21st, while just a bit further upstream at Elizabeth, the river crested at 7:30 AM on March 21st at 20.2 feet (flood stage 20.0 feet).",44
5286918,ALLEGHENY (ZONE), ,03/26/2002,1430,Flood, , ,0,0,5000,0,PA,EST, ,1132124,Z,21,PBZ,0,0,EMERGENCY MANAGER, , , , , , , , , , , , ,"Lowries Run Creek rose out of its banks, flooding Camp Horne and Harmony Roads.   Several other small streams also rose out of their banks across the county.","Another 1.0 to 1.5 inches of rain over relatively saturated ground produced widespread small stream flooding across western Pennsylvania on the 26th.",45
