EVENT_ID,CZ_NAME_STR,BEGIN_LOCATION,BEGIN_DATE,BEGIN_TIME,EVENT_TYPE,MAGNITUDE,TOR_F_SCALE,DEATHS_DIRECT,INJURIES_DIRECT,DAMAGE_PROPERTY_NUM,DAMAGE_CROPS_NUM,STATE_ABBR,CZ_TIMEZONE,MAGNITUDE_TYPE,EPISODE_ID,CZ_TYPE,CZ_FIPS,WFO,INJURIES_INDIRECT,DEATHS_INDIRECT,SOURCE,FLOOD_CAUSE,TOR_LENGTH,TOR_WIDTH,BEGIN_RANGE,BEGIN_AZIMUTH,END_RANGE,END_AZIMUTH,END_LOCATION,BEGIN_LAT,BEGIN_LON,END_LAT,END_LON,EVENT_NARRATIVE,EPISODE_NARRATIVE,ABSOLUTE_ROWNUMBER
36622,ALLEGHENY CO.,SPRINGDALE,06/08/2007,1815,Flash Flood, , ,0,0,3000,0,PA,EST-5, ,6266,C,3,PBZ,0,0,Emergency Manager,Heavy Rain, , ,0,N,0,N,SPRINGDALE,40.53,-79.77,40.53,-79.77,"Roadway flooding continued in area and along Pittsburgh Street.","A strong cold front moving southeast from the Great lakes produced widespread severe weather across Southeast Ohio, Western Pennsylvania, and Northern West Virginia.",185
36645,ALLEGHENY CO.,FOX CHAPEL,06/13/2007,1620,Thunderstorm Wind,50.00, ,0,0,2000,0,PA,EST-5,EG,6273,C,3,PBZ,0,0,Trained Spotter, , , ,5,NW,5,NW,FOX CHAPEL,40.5711,-79.9373,40.5711,-79.9373,"Trees down reported in West Deer in and around the Route 8 area.","Numerous severe thunderstorms formed ahead of a cold front moving Southeast across the Ohio Valley.",186
37882,ALLEGHENY CO.,ELIZABETH,06/19/2007,1710,Thunderstorm Wind,50.00, ,0,0,0,0,PA,EST-5,EG,6491,C,3,PBZ,0,0,Emergency Manager, , , ,0,N,0,N,ELIZABETH,40.27,-79.88,40.27,-79.88,"Trees reported down on Greenock-Buena Vista Road.","A cold front approaching from the West interacted with a warm and humid air mass provoking the development of showers and thunderstorms across the region.  Several storms became severe with damaging winds and large hail.",187
37883,ALLEGHENY CO.,BALDWIN,06/19/2007,1715,Thunderstorm Wind,50.00, ,0,0,2000,0,PA,EST-5,EG,6491,C,3,PBZ,0,0,Emergency Manager, , , ,0,N,0,N,BALDWIN,40.38,-79.95,40.38,-79.95,"Trees and wires down on Curry Road in Baldwin Borough.","A cold front approaching from the West interacted with a warm and humid air mass provoking the development of showers and thunderstorms across the region.  Several storms became severe with damaging winds and large hail.",188
37890,ALLEGHENY CO.,EAST MC KEESPORT,06/19/2007,1750,Thunderstorm Wind,50.00, ,0,0,3000,0,PA,EST-5,EG,6491,C,3,PBZ,0,0,Emergency Manager, , , ,5,NNE,5,NNE,EAST MC KEESPORT,40.4468,-79.7637,40.4468,-79.7637,"Numerous trees reported down in Monroeville area by EMA.  Basement flooding was also reported.","A cold front approaching from the West interacted with a warm and humid air mass provoking the development of showers and thunderstorms across the region.  Several storms became severe with damaging winds and large hail.",189
37891,ALLEGHENY CO.,TARENTUM,06/19/2007,1755,Thunderstorm Wind,50.00, ,0,0,3000,0,PA,EST-5,EG,6491,C,3,PBZ,0,0,Emergency Manager, , , ,2,NNE,2,NNE,TARENTUM,40.6267,-79.7554,40.6267,-79.7554,"Numerous trees reported down in the Natrona Heights area.","A cold front approaching from the West interacted with a warm and humid air mass provoking the development of showers and thunderstorms across the region.  Several storms became severe with damaging winds and large hail.",190
37892,ALLEGHENY CO.,SOUTH PARK,06/19/2007,1755,Thunderstorm Wind,50.00, ,0,0,3000,0,PA,EST-5,EG,6491,C,3,PBZ,0,0,Trained Spotter, , , ,0,N,0,N,SOUTH PARK,40.32,-80.03,40.32,-80.03,"Numerous trees down in the South Park and Bethel Park areas of Allegheny County.","A cold front approaching from the West interacted with a warm and humid air mass provoking the development of showers and thunderstorms across the region.  Several storms became severe with damaging winds and large hail.",191
37912,ALLEGHENY CO.,TARENTUM,06/21/2007,1400,Thunderstorm Wind,50.00, ,0,0,3000,0,PA,EST-5,EG,6495,C,3,PBZ,0,0,Trained Spotter, , , ,0,N,0,N,TARENTUM,40.6,-79.77,40.6,-79.77,"Trees and power lines down.  Also in Natrona Heights and Fawn Township.","A large upper-level low over the Northeast caused showers and thunderstorms to develop across the region.  Many storms became severe with damaging winds and large hail.",192
45377,ALLEGHENY CO.,PITTSBURGH,06/21/2007,1544,Thunderstorm Wind,50.00, ,0,0,4000,0,PA,EST-5,EG,6495,C,3,PBZ,0,0,Public, , , ,0,N,0,N,PITTSBURGH,40.43,-79.98,40.43,-79.98,"The public reported large tree limbs down in Pittsburgh.","A large upper-level low over the Northeast caused showers and thunderstorms to develop across the region.  Many storms became severe with damaging winds and large hail.",193
37941,ALLEGHENY CO.,PITTSBURGH,06/27/2007,1550,Thunderstorm Wind,50.00, ,0,0,2000,0,PA,EST-5,EG,6499,C,3,PBZ,0,0,Emergency Manager, , , ,5,N,5,N,PITTSBURGH,40.5023,-79.98,40.5023,-79.98,"Trees reported down in the McCandless Area.","A cold front caused showers and thunderstorms to develop across the region. Many storms became severe with damaging winds and large hail.",194
48173,ALLEGHENY CO.,GLENSHAW,07/05/2007,1146,Flash Flood, , ,0,0,10000,0,PA,EST-5, ,8422,C,3,PBZ,0,0,Law Enforcement,Heavy Rain, , ,0,N,0,N,GLENSHAW,40.55,-79.97,40.55,-79.97,"Law enforcement reported roads closed in Shaler Township due to flash flooding.","A mesoscale convective vortex ahead of a cold front over Lake Erie produced an area of thunderstorms with very heavy rainfall. Rainfall amounts across Beaver county reached more than 4 inches in 2 hours with reports of 2 to 3 inches in 2 hours common in other counties.",195
48174,ALLEGHENY CO.,GLENSHAW,07/05/2007,1205,Flash Flood, , ,0,0,10000,0,PA,EST-5, ,8422,C,3,PBZ,0,0,Law Enforcement,Heavy Rain, , ,0,N,0,N,GLENSHAW,40.55,-79.97,40.55,-79.97,"Law enforcement reported roads closed due to flash flooding in Ross Township.","A mesoscale convective vortex ahead of a cold front over Lake Erie produced an area of thunderstorms with very heavy rainfall. Rainfall amounts across Beaver county reached more than 4 inches in 2 hours with reports of 2 to 3 inches in 2 hours common in other counties.",196
48183,ALLEGHENY CO.,GLENSHAW,07/05/2007,1400,Flood, , ,0,0,0,0,PA,EST-5, ,8422,C,3,PBZ,0,0,Emergency Manager,Heavy Rain, , ,0,N,0,N,GLENSHAW,40.55,-79.97,40.55,-79.97,"Flooding continued across Shaler and Ross townships with standing water across roads slowly receding.","A mesoscale convective vortex ahead of a cold front over Lake Erie produced an area of thunderstorms with very heavy rainfall. Rainfall amounts across Beaver county reached more than 4 inches in 2 hours with reports of 2 to 3 inches in 2 hours common in other counties.",197
48196,ALLEGHENY CO.,ASPINWALL,07/17/2007,1855,Thunderstorm Wind,50.00, ,0,0,5000,0,PA,EST-5,EG,8427,C,3,PBZ,0,0,Emergency Manager, , , ,0,N,0,N,ASPINWALL,40.48,-79.88,40.48,-79.88,"Emergency management reported trees down in Aspinwall.","Isolated severe thunderstorms developed near a weak boundary across western Pennsylvania.",198
48198,ALLEGHENY CO.,PENN HILLS,07/17/2007,1900,Thunderstorm Wind,50.00, ,0,0,5000,0,PA,EST-5,EG,8427,C,3,PBZ,0,0,Trained Spotter, , , ,2,E,2,E,PENN HILLS,40.5,-79.782,40.5,-79.782,"A trained spotter reported trees down east of Penn Hills.","Isolated severe thunderstorms developed near a weak boundary across western Pennsylvania.",199
48224,ALLEGHENY CO.,INGOMAR,08/06/2007,22,Flash Flood, , ,0,0,20000,0,PA,EST-5, ,8438,C,3,PBZ,0,0,Law Enforcement,Heavy Rain, , ,2,NE,2,NE,INGOMAR,40.6005,-80.0431,40.6005,-80.0431,"Flash flooding on Lowerys Run along Camp Horne Road and Rochester Road. Rochester Road and Camp Horne closed in spots.","An area of thunderstorms with very heavy rain trained over Allegheny and Westmoreland counties causing flash flooding.",200
48225,ALLEGHENY CO.,MILLVALE,08/06/2007,40,Flash Flood, , ,0,0,50000,0,PA,EST-5, ,8438,C,3,PBZ,0,0,Law Enforcement,Heavy Rain, , ,0,N,0,N,MILLVALE,40.48,-79.98,40.48,-79.98,"Flash flooding along Girtys Run in Millvale with water in 5 to 10 homes. Some evacuations Millvale.","An area of thunderstorms with very heavy rain trained over Allegheny and Westmoreland counties causing flash flooding.",201
49000,ALLEGHENY CO.,INGRAM,08/08/2007,1700,Thunderstorm Wind,50.00, ,0,0,10000,0,PA,EST-5,EG,8550,C,3,PBZ,0,0,Emergency Manager, , , ,1,E,1,E,INGRAM,40.43,-80.07,40.43,-80.07,"Emergency management reported trees down in Crafton.","Scattered severe thunderstorms developed along a boundary across northern West Virginia, and western Pennsylvania.",202
49001,ALLEGHENY CO.,CORAOPOLIS,08/08/2007,1700,Thunderstorm Wind,50.00, ,0,0,10000,0,PA,EST-5,EG,8550,C,3,PBZ,0,0,Public, , , ,1,SE,1,SE,CORAOPOLIS,40.51,-80.16,40.51,-80.16,"The public reported trees down in Coraopolis.","Scattered severe thunderstorms developed along a boundary across northern West Virginia, and western Pennsylvania.",203
53745,ALLEGHENY CO.,NATRONA HGTS,08/09/2007,700,Thunderstorm Wind,50.00, ,0,0,10000,0,PA,EST-5,EG,9570,C,3,PBZ,0,0,Emergency Manager, , , ,1,NNW,1,NNW,NATRONA HGTS,40.6498,-79.7308,40.6498,-79.7308,"Emergency management reported numerous trees and power lines down.","Three separate mesoscale convective systems moved across Southeast Ohio, Western Pennsylvania, Northern West Virginia, and Garrett county Maryland. Widespread wind damage, flash flooding, and an EF0 tornado occurred during the event. The tornado touched down in the West End of Pittsburgh. Significant flash flooding occurred in Millvale in Allegheny county.",204
53740,ALLEGHENY CO.,GLENSHAW,08/09/2007,730,Heavy Rain, , ,0,0,0,0,PA,EST-5, ,9570,C,3,PBZ,0,0,Public, , , ,2,E,2,E,GLENSHAW,40.55,-79.932,40.55,-79.932,"Public measured 2.51 inches of rain in over an hour.","Three separate mesoscale convective systems moved across Southeast Ohio, Western Pennsylvania, Northern West Virginia, and Garrett county Maryland. Widespread wind damage, flash flooding, and an EF0 tornado occurred during the event. The tornado touched down in the West End of Pittsburgh. Significant flash flooding occurred in Millvale in Allegheny county.",205
53741,ALLEGHENY CO.,INGOMAR,08/09/2007,730,Heavy Rain, , ,0,0,0,0,PA,EST-5, ,9570,C,3,PBZ,0,0,Trained Spotter, , , ,2,E,2,E,INGOMAR,40.58,-80.03,40.58,-80.03,"A trained spotter reported 3.57 inches of rain in 2 hours.","Three separate mesoscale convective systems moved across Southeast Ohio, Western Pennsylvania, Northern West Virginia, and Garrett county Maryland. Widespread wind damage, flash flooding, and an EF0 tornado occurred during the event. The tornado touched down in the West End of Pittsburgh. Significant flash flooding occurred in Millvale in Allegheny county.",206
53715,ALLEGHENY CO.,PENN HILLS,08/09/2007,748,Flash Flood, , ,0,0,100000,0,PA,EST-5, ,9570,C,3,PBZ,0,0,Trained Spotter,Heavy Rain, , ,0,N,0,N,PENN HILLS,40.5,-79.82,40.5,-79.82,"A trained spotter reported Sandt Creek out of its banks flooding portions of Rodi road. Numerous basements with up to three feet of water in them from poor drainage flooding around 3rd street in Penn Hills.","Three separate mesoscale convective systems moved across Southeast Ohio, Western Pennsylvania, Northern West Virginia, and Garrett county Maryland. Widespread wind damage, flash flooding, and an EF0 tornado occurred during the event. The tornado touched down in the West End of Pittsburgh. Significant flash flooding occurred in Millvale in Allegheny county.",207
53716,ALLEGHENY CO.,VERONA,08/09/2007,750,Flash Flood, , ,0,0,15000,0,PA,EST-5, ,9570,C,3,PBZ,0,0,Public,Heavy Rain, , ,0,N,0,N,VERONA,40.52,-79.83,40.52,-79.83,"Public reported streams over roads and bridges in Verona.","Three separate mesoscale convective systems moved across Southeast Ohio, Western Pennsylvania, Northern West Virginia, and Garrett county Maryland. Widespread wind damage, flash flooding, and an EF0 tornado occurred during the event. The tornado touched down in the West End of Pittsburgh. Significant flash flooding occurred in Millvale in Allegheny county.",208
53720,ALLEGHENY CO.,SHALECREST,08/09/2007,815,Flash Flood, , ,0,0,25000,0,PA,EST-5, ,9570,C,3,PBZ,0,0,Trained Spotter,Heavy Rain, , ,1,ESE,1,ESE,SHALECREST,40.51,-79.95,40.51,-79.95,"A trained spotter reported Girtys Run creek is out of its banks and flooding  portions of Babcock Blvd and other roads in the area.","Three separate mesoscale convective systems moved across Southeast Ohio, Western Pennsylvania, Northern West Virginia, and Garrett county Maryland. Widespread wind damage, flash flooding, and an EF0 tornado occurred during the event. The tornado touched down in the West End of Pittsburgh. Significant flash flooding occurred in Millvale in Allegheny county.",209
53751,ALLEGHENY CO.,HIGHCLIFF,08/09/2007,1355,Thunderstorm Wind,50.00, ,0,0,50000,0,PA,EST-5,EG,9570,C,3,PBZ,0,0,Emergency Manager, , , ,1,NE,1,NE,HIGHCLIFF,40.53,-80.02,40.53,-80.02,"Emergency management reported trees and power lines down near the Ross Park Mall.","Three separate mesoscale convective systems moved across Southeast Ohio, Western Pennsylvania, Northern West Virginia, and Garrett county Maryland. Widespread wind damage, flash flooding, and an EF0 tornado occurred during the event. The tornado touched down in the West End of Pittsburgh. Significant flash flooding occurred in Millvale in Allegheny county.",210
53767,ALLEGHENY CO.,PITTSBURGH,08/09/2007,1400,Thunderstorm Wind,74.00, ,0,0,250000,0,PA,EST-5,EG,9570,C,3,PBZ,0,0,NWS Storm Survey, , , ,0,N,0,N,PITTSBURGH,40.43,-79.98,40.43,-79.98,"A microburst hit the Uptown section of Pittsburgh with damage from along Fifth Street to Moultrie Street. Numerous buildings had structural damage with walls of several buildings collapsed and roofs torn off. Several buildings also has windows broken and siding torn off. Trees were also snapped off. The damage extended for about 700 yards and was 400 yards wide.","Three separate mesoscale convective systems moved across Southeast Ohio, Western Pennsylvania, Northern West Virginia, and Garrett county Maryland. Widespread wind damage, flash flooding, and an EF0 tornado occurred during the event. The tornado touched down in the West End of Pittsburgh. Significant flash flooding occurred in Millvale in Allegheny county.",211
53752,ALLEGHENY CO.,OPTION,08/09/2007,1414,Thunderstorm Wind,50.00, ,0,0,30000,0,PA,EST-5,EG,9570,C,3,PBZ,0,0,Amateur Radio, , , ,1,N,1,N,OPTION,40.44,-79.98,40.44,-79.98,"Amateur radio reported trees down on East Carson Street as well as in  the vicinity of Forbes and Braddock.","Three separate mesoscale convective systems moved across Southeast Ohio, Western Pennsylvania, Northern West Virginia, and Garrett county Maryland. Widespread wind damage, flash flooding, and an EF0 tornado occurred during the event. The tornado touched down in the West End of Pittsburgh. Significant flash flooding occurred in Millvale in Allegheny county.",212
53724,ALLEGHENY CO.,MILLVALE,08/09/2007,1420,Flash Flood, , ,0,0,15000000,0,PA,EST-5, ,9570,C,3,PBZ,0,0,Emergency Manager,Heavy Rain, , ,0,N,0,N,MILLVALE,40.48,-79.98,40.48,-79.98,"Heavy rain caused flash flooding in the Millvale area and much of the North Hills area of Pittsburgh as Girtys Run came out of it's banks. Over 900 homes were affected by the flooding as well as over 200 businesses. Infrasturcture owned by local municipalities sustained over 4 million dollars in damage.","Three separate mesoscale convective systems moved across Southeast Ohio, Western Pennsylvania, Northern West Virginia, and Garrett county Maryland. Widespread wind damage, flash flooding, and an EF0 tornado occurred during the event. The tornado touched down in the West End of Pittsburgh. Significant flash flooding occurred in Millvale in Allegheny county.",213
53729,ALLEGHENY CO.,GLENSHAW,08/09/2007,1503,Flash Flood, , ,0,0,15000,0,PA,EST-5, ,9570,C,3,PBZ,0,0,Amateur Radio,Heavy Rain, , ,1,S,1,S,GLENSHAW,40.5355,-79.97,40.5355,-79.97,"Amateur radio reported Mcnight road closed due to flash flooding.","Three separate mesoscale convective systems moved across Southeast Ohio, Western Pennsylvania, Northern West Virginia, and Garrett county Maryland. Widespread wind damage, flash flooding, and an EF0 tornado occurred during the event. The tornado touched down in the West End of Pittsburgh. Significant flash flooding occurred in Millvale in Allegheny county.",214
53760,ALLEGHENY CO.,SHALECREST,08/09/2007,1800,Thunderstorm Wind,50.00, ,0,0,50000,0,PA,EST-5,EG,9570,C,3,PBZ,0,0,Emergency Manager, , , ,1,E,1,E,SHALECREST,40.52,-79.96,40.52,-79.96,"Emergency management reported trees and wires down in Shaler TWP.","Three separate mesoscale convective systems moved across Southeast Ohio, Western Pennsylvania, Northern West Virginia, and Garrett county Maryland. Widespread wind damage, flash flooding, and an EF0 tornado occurred during the event. The tornado touched down in the West End of Pittsburgh. Significant flash flooding occurred in Millvale in Allegheny county.",215
53774,ALLEGHENY CO.,WILKINSBURG,08/09/2007,1807,Flash Flood, , ,0,0,25000,0,PA,EST-5, ,9570,C,3,PBZ,0,0,Emergency Manager,Heavy Rain, , ,0,N,0,N,WILKINSBURG,40.43,-79.85,40.43,-79.85,"Emergency management reported flash flooding closing some roads in Wilkinsburg.","Three separate mesoscale convective systems moved across Southeast Ohio, Western Pennsylvania, Northern West Virginia, and Garrett county Maryland. Widespread wind damage, flash flooding, and an EF0 tornado occurred during the event. The tornado touched down in the West End of Pittsburgh. Significant flash flooding occurred in Millvale in Allegheny county.",216
53761,ALLEGHENY CO.,ROSEDALE,08/09/2007,1810,Thunderstorm Wind,50.00, ,0,0,50000,0,PA,EST-5,EG,9570,C,3,PBZ,0,0,Emergency Manager, , , ,1,W,1,W,ROSEDALE,40.48,-79.83,40.48,-79.83,"Emergency management reported trees down in Penn Hills.","Three separate mesoscale convective systems moved across Southeast Ohio, Western Pennsylvania, Northern West Virginia, and Garrett county Maryland. Widespread wind damage, flash flooding, and an EF0 tornado occurred during the event. The tornado touched down in the West End of Pittsburgh. Significant flash flooding occurred in Millvale in Allegheny county.",217
59914,ALLEGHENY CO.,OPTION,09/26/2007,1850,Thunderstorm Wind,50.00, ,0,0,30000,0,PA,EST-5,EG,10796,C,3,PBZ,0,0,Emergency Manager, , , ,1,N,1,N,OPTION,40.44,-79.98,40.44,-79.98,"Emergency management reported trees and wires down in the north side region of Pittsburgh and in Lawrenceville.","Scattered severe thunderstorms developed over Western Pennsylvania and Northern West Virginia ahead of a strong cold front moving east from the Great Lakes.",218
76350,ALLEGHENY (ZONE), ,01/30/2008,300,High Wind,50.00, ,0,0,75000,0,PA,EST-5,EG,13639,Z,21,PBZ,0,0,Emergency Manager, , , , , , , , , , , , ,"","A large area of low pressure over the Great Lakes pushed a strong cold front across the region during the morning of January 30th. The strong pressure gradient along and behind the front produced wind gusts near 60 MPH in many locations across western Pennsylvania, northern West Virginia, eastern Ohio, and Garrett county Maryland. This produced numerous reports of trees and power lines down across the region.",219
83279,ALLEGHENY (ZONE), ,02/06/2008,1800,High Wind,50.00, ,0,0,75000,0,PA,EST-5,EG,14708,Z,21,PBZ,0,0,NWS Employee, , , , , , , , , , , , ,"","Strong winds behind a cold front caused wind damage over portions of Allegheny and Washington counties with large trees and wires down. Numerous power outages were reported.",220
83291,ALLEGHENY (ZONE), ,02/10/2008,1300,High Wind,50.00, ,0,0,100000,0,PA,EST-5,EG,14710,Z,21,PBZ,0,0,Emergency Manager, , , , , , , , , , , , ,"","High winds behind a strong cold front produced numerous reports of power lines and trees down across Allegheny county.",221
81990,ALLEGHENY (ZONE), ,02/12/2008,700,Winter Storm, , ,0,0,0,0,PA,EST-5, ,14533,Z,21,PBZ,0,0,Law Enforcement, , , , , , , , , , , , ,"","A heavy mixture of winter precipitation fell across western Pennsylvania, southeast Ohio, and the northern panhandle of West Virginia on February 12th as an area of low pressure moved across the upper Ohio Valley just south of Pittsburgh. Snowfall of 4-6 inches was common with ice accumulation from freezing rain over one tenth of an inch as well as light sleet accumulations. Travel was extremely hazardous with disruption to schools and some businesses.",222
82004,ALLEGHENY (ZONE), ,02/29/2008,900,Heavy Snow, , ,0,0,0,0,PA,EST-5, ,14539,Z,21,PBZ,0,0,Trained Spotter, , , , , , , , , , , , ,"","Low pressure moving quickly across the Ohio Valley brought heavy snow to parts of western Pennsylvania, northern West Virginia, and Garrett county Maryland. Snow fell ahead of the system followed by lake enhanced snow in cold northwest flow behind the low pressure. Snowfall amounts were generally 6 to 8 inches in 12 hours.",223
87833,ALLEGHENY CO.,BRIDGEVILLE,03/04/2008,1050,Flood, , ,0,0,100000,0,PA,EST-5, ,15456,C,3,PBZ,0,0,Emergency Manager,Heavy Rain / Snow Melt, , ,0,N,0,N,PORT VUE,40.37,-80.13,40.357,-79.8692,"Emergency management reported basement and street flooding across much of Pittsburgh and the northern suburbs due to storm drains backing up due to heavy rain and snow melt.","Snow melt combined with heavy rain across eastern Ohio and western Pennsylvania produced widespread flooding of streams and closing of roads.",224
102597,ALLEGHENY CO.,BRADFORD WOODS,06/16/2008,1510,Thunderstorm Wind,50.00, ,0,0,50000,0,PA,EST-5,EG,17728,C,3,PBZ,0,0,Emergency Manager, , , ,0,N,0,N,BRADFORD WOODS,40.63,-80.08,40.63,-80.08,"Emergency management reported power lines down around Bradford Woods.","Numerous severe thunderstorms developed ahead of a strong cold front moving across the Ohio Valley, producing large hail and wind damage across eastern Ohio, western Pennsylvania, northern West Virginia, and Garrett county Maryland. Isolated flash flooding also occurred across western Pennsylvania.",225
102598,ALLEGHENY CO.,RUSSELTON,06/16/2008,1530,Thunderstorm Wind,50.00, ,0,0,75000,0,PA,EST-5,EG,17728,C,3,PBZ,0,0,Emergency Manager, , , ,0,SE,0,SE,RUSSELTON,40.62,-79.83,40.62,-79.83,"Emergency management reported large trees down in Russellton.","Numerous severe thunderstorms developed ahead of a strong cold front moving across the Ohio Valley, producing large hail and wind damage across eastern Ohio, western Pennsylvania, northern West Virginia, and Garrett county Maryland. Isolated flash flooding also occurred across western Pennsylvania.",226
102623,ALLEGHENY CO.,HARDY,06/16/2008,1650,Flash Flood, , ,0,0,125000,0,PA,EST-5, ,17728,C,3,PBZ,0,0,Emergency Manager,Heavy Rain, , ,1,NW,1,NW,HARDY,40.6344,-79.9841,40.627,-79.9798,"Emergency management reported flash flooding on SR 910 and Grubs Rd with homes flooded on Ramsgate rd. Deer Creek out of it's banks and flooding Gibsonia Rd.","Numerous severe thunderstorms developed ahead of a strong cold front moving across the Ohio Valley, producing large hail and wind damage across eastern Ohio, western Pennsylvania, northern West Virginia, and Garrett county Maryland. Isolated flash flooding also occurred across western Pennsylvania.",227
104263,ALLEGHENY CO.,BAYNE,06/26/2008,1845,Thunderstorm Wind,50.00, ,0,0,75000,0,PA,EST-5,EG,17955,C,3,PBZ,0,0,Emergency Manager, , , ,1,ESE,1,ESE,BAYNE,40.59,-80.1,40.59,-80.1,"Emergency management reported trees and power lines down in Franklin Park.","Severe thunderstorms formed along a stalled frontal boundary across the Ohio valley as an upper level disturbance moved southeast along the front. Heavy rainfall from the storms also caused isolated flooding.",228
104264,ALLEGHENY CO.,CARNEGIE,06/26/2008,1920,Thunderstorm Wind,50.00, ,0,0,35000,0,PA,EST-5,EG,17955,C,3,PBZ,0,0,Emergency Manager, , , ,1,SW,1,SW,CARNEGIE,40.41,-80.09,40.41,-80.09,"Emergency management reported trees down in Carnegie.","Severe thunderstorms formed along a stalled frontal boundary across the Ohio valley as an upper level disturbance moved southeast along the front. Heavy rainfall from the storms also caused isolated flooding.",229
104265,ALLEGHENY CO.,RIVERTON,06/26/2008,1930,Thunderstorm Wind,50.00, ,0,0,25000,0,PA,EST-5,EG,17955,C,3,PBZ,0,0,Emergency Manager, , , ,1,SE,1,SE,RIVERTON,40.34,-79.84,40.34,-79.84,"Emergency management reported trees down near McKeesport.","Severe thunderstorms formed along a stalled frontal boundary across the Ohio valley as an upper level disturbance moved southeast along the front. Heavy rainfall from the storms also caused isolated flooding.",230
114873,ALLEGHENY CO.,WOODVILLE,06/28/2008,1745,Thunderstorm Wind,50.00, ,0,0,75000,0,PA,EST-5,EG,19419,C,3,PBZ,0,0,Broadcast Media, , , ,1,ENE,1,ENE,WOODVILLE,40.384,-80.0871,40.384,-80.0871,"Local television reported 30 large trees down on Scott Twp municipal park.","An MCS formed along a stalled frontal boundary across the Ohio Valley.  These severe thunderstorms produced significant wind damage across parts of eastern Ohio, the northern West Virginia panhandle, and western Pennsylvania.",231
114872,ALLEGHENY CO.,MAGILL HGTS,06/28/2008,1750,Thunderstorm Wind,50.00, ,0,0,35000,0,PA,EST-5,EG,19419,C,3,PBZ,0,0,Amateur Radio, , , ,2,SW,2,SW,MAGILL HGTS,40.6051,-79.8739,40.6051,-79.8739,"Amateur radio reported large trees down on West Starz Rd IN West Deer  Twp.","An MCS formed along a stalled frontal boundary across the Ohio Valley.  These severe thunderstorms produced significant wind damage across parts of eastern Ohio, the northern West Virginia panhandle, and western Pennsylvania.",232
114870,ALLEGHENY CO.,MT NEBO,06/28/2008,1758,Thunderstorm Wind,50.00, ,0,0,100000,0,PA,EST-5,EG,19419,C,3,PBZ,0,0,Amateur Radio, , , ,1,ENE,1,ENE,MT NEBO,40.5532,-80.1084,40.5532,-80.1084,"Amateur radio reported trees and power lines down near the Mt Nebo exit of I-79 in Wexford. Some roads reported closed.","An MCS formed along a stalled frontal boundary across the Ohio Valley.  These severe thunderstorms produced significant wind damage across parts of eastern Ohio, the northern West Virginia panhandle, and western Pennsylvania.",233
